{
  "meta": {
    "task_id": "task-737a0c62df06",
    "trace_id": "task-737a0c62df06",
    "stage": "code",
    "generated_at": "2026-02-09T02:52:47.601521+00:00",
    "source_language": "COBOL",
    "target_language": "Java",
    "module": "UNKNOWN"
  },
  "unknowns": [],
  "extensions": {
    "compile": {
      "success": true,
      "errors": []
    }
  },
  "target_code": "package com.migration.generated;\n\n/**\n * 移行元: HELLO-WORLD\n * 生成者: CodeMigrationAgent\n */\npublic class HelloWorld {\n\n    // === Fields (WORKING-STORAGE) ===\n    private String message;\n\n    // === Methods (PROCEDURE DIVISION) ===\n    // TODO: LLM will generate method implementations\n\n    public static void main(String[] args) {\n        HelloWorld instance = new HelloWorld();\n        // TODO: Call entry point method\n    }\n}",
  "generated_files": [
    {
      "path": "generated/HelloWorld.java",
      "content": "package com.migration.generated;\n\n/**\n * 移行元: HELLO-WORLD\n * 生成者: CodeMigrationAgent\n */\npublic class HelloWorld {\n\n    // === Fields (WORKING-STORAGE) ===\n    private String message;\n\n    // === Methods (PROCEDURE DIVISION) ===\n    // TODO: LLM will generate method implementations\n\n    public static void main(String[] args) {\n        HelloWorld instance = new HelloWorld();\n        // TODO: Call entry point method\n    }\n}"
    }
  ],
  "rule_hits": [
    "class_mapping.primary_class",
    "package_mapping.default",
    "state_model.variables"
  ],
  "warnings": []
}